{
  "schema": "mh.staff",
  "schema_version": 1,
  "status": "PARAMETERS, NOT FINAL. Wages, work rates, decay and effect sizes are placeholders tuned with tools/reference/staff/staff_sim.py against the DEC-069 economy. Money is integer CENTS in this file (the economy keeps cents).",
  "grid": {
    "cols": 4,
    "rows": 4
  },
  "grades": [
    {
      "id": "trainee",
      "name_key": "staff.grade.trainee",
      "min_tenure_days": 0,
      "wage_permille": 1000,
      "work_permille": 1000
    },
    {
      "id": "regular",
      "name_key": "staff.grade.regular",
      "min_tenure_days": 20,
      "wage_permille": 1250,
      "work_permille": 1300
    },
    {
      "id": "veteran",
      "name_key": "staff.grade.veteran",
      "min_tenure_days": 60,
      "wage_permille": 1500,
      "work_permille": 1700
    }
  ],
  "params": {
    "max_employees": 120,
    "max_areas_per_employee": 6,
    "auto_assign_span": 4,
    "tenure_gate_days": 3,
    "hire_cost_days": 5,
    "hire_reserve_days": 3,
    "cond_start": 700,
    "cond_untended_floor": 400,
    "cond_hard_floor": 250,
    "pest_start": 100,
    "keeper_work": 240,
    "ranger_control": 150,
    "pest_growth_base": 20,
    "pest_growth_cond_div": 20,
    "pest_natural_cap": 500,
    "pest_decline_above_cap": 15,
    "pest_damage_div": 25,
    "incident_chance_div": 20000,
    "incident_max_per_day": 3,
    "handled_min_control": 30,
    "handled_damage_pct": 25,
    "sighting_chance_permille": 12,
    "sighting_ranger_bonus_permille": 8,
    "sighting_max_pest": 150,
    "sighting_min_cond": 750,
    "personal_pass_gain": 300,
    "personal_daily_cap": 600,
    "personal_patrol_gain": 200,
    "personal_patrol_cap": 400,
    "demand_min": 900,
    "demand_max": 1080,
    "cond_neutral": 600,
    "cond_k_permille": 100,
    "pest_k_permille": 40,
    "service_neutral": 500,
    "service_k_permille": 60,
    "sat_cond_floor": 600,
    "sat_pen_max": 150,
    "sat_pen_span": 350,
    "overlay_beauty_k": 100,
    "overlay_fairness_k": 50,
    "service_rec_by_tier": [
      1,
      1,
      1,
      2,
      2
    ]
  },
  "decay_by_parcel_kind": {
    "golf": 60,
    "facility": 30,
    "homes": 20
  },
  "roles": [
    {
      "id": "groundskeeper",
      "name_key": "staff.role.groundskeeper",
      "building": "maintenance",
      "kind": "grounds",
      "legacy": "greenkeepers",
      "daily_wage_cents": 2200,
      "caps_by_tier": [
        2,
        3,
        4,
        6,
        8
      ],
      "pace_each": 0,
      "pace_max": 0
    },
    {
      "id": "superintendent",
      "name_key": "staff.role.superintendent",
      "building": "maintenance",
      "kind": "station",
      "legacy": "greenkeepers",
      "daily_wage_cents": 5200,
      "caps_by_tier": [
        0,
        1,
        1,
        1,
        1
      ],
      "pace_each": 0,
      "pace_max": 0
    },
    {
      "id": "wildlife_ranger",
      "name_key": "staff.role.wildlife_ranger",
      "building": "maintenance",
      "kind": "pest",
      "legacy": "greenkeepers",
      "daily_wage_cents": 2800,
      "caps_by_tier": [
        0,
        1,
        2,
        3,
        4
      ],
      "pace_each": 0,
      "pace_max": 0
    },
    {
      "id": "marshal",
      "name_key": "staff.role.marshal",
      "building": "clubhouse",
      "kind": "station",
      "legacy": "marshals",
      "daily_wage_cents": 2000,
      "caps_by_tier": [
        1,
        1,
        2,
        2,
        2
      ],
      "pace_each": 3,
      "pace_max": 9
    },
    {
      "id": "caddie",
      "name_key": "staff.role.caddie",
      "building": "cart_barn",
      "kind": "station",
      "legacy": "marshals",
      "daily_wage_cents": 2000,
      "caps_by_tier": [
        1,
        1,
        2,
        2,
        2
      ],
      "pace_each": 3,
      "pace_max": 6
    },
    {
      "id": "pro_shop_assistant",
      "name_key": "staff.role.pro_shop_assistant",
      "building": "pro_shop",
      "kind": "station",
      "legacy": "pro_shop_staff",
      "daily_wage_cents": 1900,
      "caps_by_tier": [
        1,
        1,
        2,
        2,
        2
      ],
      "pace_each": 0,
      "pace_max": 0
    },
    {
      "id": "range_attendant",
      "name_key": "staff.role.range_attendant",
      "building": "driving_range",
      "kind": "station",
      "legacy": "pro_shop_staff",
      "daily_wage_cents": 1800,
      "caps_by_tier": [
        1,
        1,
        2,
        2,
        2
      ],
      "pace_each": 0,
      "pace_max": 0
    },
    {
      "id": "server",
      "name_key": "staff.role.server",
      "building": "restaurant",
      "kind": "station",
      "legacy": "caterers",
      "daily_wage_cents": 1800,
      "caps_by_tier": [
        1,
        1,
        2,
        2,
        2
      ],
      "pace_each": 0,
      "pace_max": 0
    },
    {
      "id": "spa_attendant",
      "name_key": "staff.role.spa_attendant",
      "building": "pool_spa",
      "kind": "station",
      "legacy": "caterers",
      "daily_wage_cents": 2400,
      "caps_by_tier": [
        1,
        1,
        2,
        2,
        2
      ],
      "pace_each": 0,
      "pace_max": 0
    },
    {
      "id": "housekeeper",
      "name_key": "staff.role.housekeeper",
      "building": "lodging",
      "kind": "station",
      "legacy": "caterers",
      "daily_wage_cents": 1900,
      "caps_by_tier": [
        1,
        1,
        2,
        2,
        2
      ],
      "pace_each": 0,
      "pace_max": 0
    },
    {
      "id": "concierge",
      "name_key": "staff.role.concierge",
      "building": "homes",
      "kind": "station",
      "legacy": "caterers",
      "daily_wage_cents": 3000,
      "caps_by_tier": [
        1,
        1,
        2,
        2,
        2
      ],
      "pace_each": 0,
      "pace_max": 0
    },
    {
      "id": "guide",
      "name_key": "staff.role.guide",
      "building": "landmark",
      "kind": "station",
      "legacy": "caterers",
      "daily_wage_cents": 2500,
      "caps_by_tier": [
        1,
        1,
        2,
        2,
        2
      ],
      "pace_each": 0,
      "pace_max": 0
    }
  ],
  "incident_kinds": [
    {
      "id": "burrowers",
      "name_key": "staff.incident.burrowers",
      "cond_damage": 140,
      "pest_add": 80
    },
    {
      "id": "goose_flock",
      "name_key": "staff.incident.goose_flock",
      "cond_damage": 60,
      "pest_add": 40
    },
    {
      "id": "insect_swarm",
      "name_key": "staff.incident.insect_swarm",
      "cond_damage": 100,
      "pest_add": 120
    }
  ],
  "sighting_kinds": [
    {
      "id": "deer",
      "name_key": "staff.sighting.deer"
    },
    {
      "id": "heron",
      "name_key": "staff.sighting.heron"
    },
    {
      "id": "fox",
      "name_key": "staff.sighting.fox"
    }
  ]
}
